field name,description
category,"A ServiceCategoryRef. List of service categories associated with this catalog."
description,"A String. Description of this catalog."
href,"A String. Hyperlink reference."
id,"A String. Unique identifier."
lastUpdate,"A DateTime. Date and time of the last update."
lifecycleStatus,"A String. Used to indicate the current lifecycle status."
relatedParty,"A RelatedParty. List of parties or party roles related to this category."
validFor,"A TimePeriod."
version,"A String. ServiceCatalog version."